{
    "logging": {
        "level": "INFO",
        "file": "ares.log",
        "max_bytes": 10485760,
        "backup_count": 5,
        "console_output": true,
        "module_levels": {
            "ARES.Feature.ProxyManager": "DEBUG",
            "ARES.Feature.PathSelector": "DEBUG"
        }
    },
    "ares_core": {
        "rns_config_path": "~/.ares-reticulum",
        "enable_transport_node_features": false,
        "config_schema_path": "config_schema.json",
        "main_loop_sleep_interval": 30
    },
    "request_retries": {
        "enabled": true,
        "default_max_retries": 3,
        "default_delay_seconds": 1,
        "default_backoff_factor": 2,
        "default_jitter_max_seconds": 0.5,
        "log_retries": true
    },
    "path_selection": {
        "enabled": true,
        "default_metric": "rtt",
        "metric_update_interval_seconds": 60,
        "custom_metrics_module": null,
        "rtt_probe_timeout_seconds": 5,
        "max_paths_to_consider": 5
    },
    "destination_proxying": {
        "enabled": true,
        "proxy_routes": [
            {
                "alias": "secure_exit_1",
                "entry_destination_name": "ares.proxy.entry.exit1",
                "exit_node_identity_hash": "abcdef1234567890abcdef1234567890",
                "target_network_prefix": "app_name.service_behind_firewall",
                "allow_all_targets": false,
                "allowed_target_aspects": ["data_service", "control_service"]
            }
        ],
        "is_proxy_node": false,
        "listen_on_aspect": "proxy_service",
        "max_payload_size_bytes": 1048576,
        "default_request_timeout_seconds": 15,
        "proxy_protocol_version": "1.0"
    },
    "monitoring": {
        "enabled": true,
        "prometheus_port": 9876,
        "listen_host": "127.0.0.1",
        "metrics_prefix": "ares",
        "enable_health_endpoint": true
    }
}
